{
  "schemaVersion": "uis.head-preparation.quick-pixelize-config/1",
  "algorithmVersion": "1.0.0",
  "alpha": {
    "mode": "clear-at-or-below",
    "threshold": 15
  },
  "bounds": {
    "mode": "normalized-alpha-content"
  },
  "target": {
    "width": 64,
    "height": 64,
    "fit": "contain"
  },
  "resampling": "nearest-neighbor",
  "transparentPadding": {
    "top": 0,
    "right": 0,
    "bottom": 0,
    "left": 0
  },
  "pngEncoding": {
    "colorType": "rgba",
    "bitDepth": 8,
    "filterType": 0,
    "deflateLevel": 9,
    "deflateStrategy": 3
  }
}
